{
  "$schema": "https://json-schema.org/draft/2020-12/schema",
  "$id": "https://schemas.simintero.io/canonical/case.json",
  "title": "Case",
  "description": "Canonical PA case — aggregate root. Every field that touches PHI carries tenant_id.",
  "type": "object",
  "properties": {
    "case_id":             { "type": "string", "format": "uuid" },
    "tenant_id":           { "type": "string" },
    "correlation_id":      { "type": "string" },
    "lob":                 { "type": "string" },
    "program":             { "type": "string" },
    "status": {
      "type": "string",
      "enum": [
        "intake", "completeness_check", "auto_determination", "clinical_review",
        "pend_rfi", "approved", "denied", "partially_denied",
        "adverse_modification", "withdrawn", "closed",
        "determined", "voided"
      ]
    },
    "urgency": {
      "type": "string",
      "enum": ["standard", "expedited", "concurrent"]
    },
    "member":              { "$ref": "member.json" },
    "coverage":            { "$ref": "coverage.json" },
    "requesting_provider": { "$ref": "provider.json" },
    "servicing_provider":  { "$ref": "provider.json" },
    "service_lines": {
      "type": "array",
      "items": { "$ref": "service_line.json" },
      "minItems": 1
    },
    "decisions": {
      "type": "array",
      "items": { "$ref": "decision.json" },
      "default": []
    },
    "created_at": { "type": "string", "format": "date-time" },
    "updated_at": { "type": "string", "format": "date-time" }
  },
  "required": [
    "case_id", "tenant_id", "correlation_id", "lob",
    "status", "urgency", "member", "coverage",
    "requesting_provider", "service_lines",
    "created_at", "updated_at"
  ],
  "additionalProperties": false
}
