{
  "case_id": "11111111-1111-4111-8111-111111111111",
  "tenant_id": "t_acme",
  "correlation_id": "case_123",
  "lob": "MA",
  "program": "DSNP",
  "status": "intake",
  "urgency": "standard",
  "member": {
    "member_id": "22222222-2222-4222-8222-222222222222",
    "tenant_id": "t_acme",
    "mrn": "MRN-0001",
    "first_name": "Jane",
    "last_name": "Doe",
    "date_of_birth": "1980-01-15",
    "gender": "F",
    "identifiers": [
      { "system": "https://hl7.org/fhir/sid/us-mbi", "value": "1EG4-TE5-MK73" }
    ]
  },
  "coverage": {
    "coverage_id": "33333333-3333-4333-8333-333333333333",
    "tenant_id": "t_acme",
    "member_id": "22222222-2222-4222-8222-222222222222",
    "plan_id": "PLAN-MA-001",
    "group_id": "GRP-100",
    "subscriber_id": "SUB-555",
    "payer_name": "Acme Health",
    "lob": "medicare",
    "effective_date": "2026-01-01",
    "termination_date": "2026-12-31"
  },
  "requesting_provider": {
    "provider_id": "44444444-4444-4444-8444-444444444444",
    "tenant_id": "t_acme",
    "npi": "1234567890",
    "name": "Dr. Alan Grant",
    "specialty": "Cardiology",
    "organization_name": "Acme Cardiology Associates",
    "identifiers": []
  },
  "servicing_provider": {
    "provider_id": "55555555-5555-4555-8555-555555555555",
    "tenant_id": "t_acme",
    "npi": "9876543210",
    "name": "Acme Surgical Center"
  },
  "service_lines": [
    {
      "service_line_id": "66666666-6666-4666-8666-666666666666",
      "tenant_id": "t_acme",
      "sequence": 1,
      "service_type_code": "3",
      "procedure_code": "93452",
      "procedure_description": "Left heart catheterization",
      "quantity": 1,
      "units": "EA",
      "diagnosis_codes": ["I25.10"],
      "place_of_service": "21",
      "requested_start_date": "2026-07-01",
      "requested_end_date": "2026-07-01"
    }
  ],
  "decisions": [],
  "created_at": "2026-06-14T12:00:00Z",
  "updated_at": "2026-06-14T12:00:00Z"
}
